	x	y
3119	did you pick a route with no traffic?	traffic_info
3120	car, what is my home address and can you get us there with no traffic?	poi_type&traffic_info
3121	patience, please set the gps to go there, thank you!	address&poi&poi_type&traffic_info
3122	hi car, i need to find out the time and date for my dinner please. 	event
3123	please confirm the address and give me directions via a route with no traffic to home. 	poi&poi_type&traffic_info
3124	yes i got to get home. thanks.	address&poi&poi_type&traffic_info
3125	is it gonna be misty in corona on monday?	date&location&weather_attribute
3126	where's the nearest parking garage	distance&poi_type
3127	please send me its address on the screen and pick a quick route to reach there, thank you!	poi
3128	schedule a conference with management on the 7th at 2pm.	date&event&party&time
3129	check the weather for today	date
3130	i wanting to know if it will rain in grand rapids today	date&location&weather_attribute
3131	what time do i play tennis, and who is coming?	event
3132	what's the weather forecast for tomorrow	date
3133	please give me directions to a nearby parking garage parking lot	distance&poi_type
3134	yes.	poi
3135	where is the closest rest stop with no traffic? 	distance&poi_type&traffic_info
3136	yes, please, send me its position on the screen and pick the quickest route to reach there, thank you!	poi&traffic_info
3137	schedule a conference with hr. 	event&party
3138	at 2 pm tomorrow	date&event&time
3139	schedule an appointment at 5pm at the end of march with tom.	date&event&party&time
3140	set the appointment to be a lab appointment.	event
3141	where is the closest place to eat	distance&poi_type
3142	i think i want pizza tonight, can you give me directions?	poi
3143	give me the quickest route please. 	traffic_info
3144	what is the date and time for my doctor appointment?	event
3145	what is the weather like today	date
3146	will it be hot in compton today?	location&weather_attribute
3147	schedule a blood test	event
3148	car my friends' house should be in the area: do you see it on your map?	poi_type
3149	yes, please pick the shortest distance too	distance
3150	set a reminder for lab appointment today at 3 pm with sister. 	date&event&party&time
3151	find weekly weather forecast	date
3152	mountain view please.	date&location
3153	schedule a reminder for football with ana on the 15th of this month at 11am.	date&event&party&time
3154	will it be stormy in exeter in the next 7 days?	date&location&weather_attribute
3155	is it going to snow this week	date&weather_attribute
3156	can you tell me about menlo park?	date&location&weather_attribute
3157	i need the quickest route to a rest stop. i am so tired.	distance&poi_type
3158	that's good, thank you car, let's go there!	poi
3159	please set directions via the quickest route, and thanks again. 	distance
3160	find me a place where i could have some coffee.	poi_type
3161	which is within 5 miles?	distance
3162	what's the forecast going to be for today and tomorrow	date&weather_attribute
3163	i need to know if there will be frost in durham for today and tomorrow car.	date&location&weather_attribute
3164	what time is my doctor's appointment	event
3165	what is the forecast for the rest of the day	date
3166	tell me if it's windy in exeter right now	date&location&weather_attribute
3167	is it windy right now?	date&weather_attribute
3168	is the weather warm in atherton now?	date&location&weather_attribute
3169	set alarm for dinner tonight	agenda&date&event
3170	is it going to rain sometime this week	date&weather_attribute
3171	downtown chicago please. find out if it will rain this week.	date&location&weather_attribute
3172	will the weather be cloudy next week	date&weather_attribute
3173	will it be cloudy in carson next week?	date&location&weather_attribute
3174	tell me when my doctor's appointment is	event
3175	what is the forecast in my city	location
3176	what is the forecast for today and tomorrow in durham?	date&location
3177	please let me know the weather forecast for tomorrow	date
3178	durham, specifically if there will be any frost.	date&location&weather_attribute
3179	find me a place where i can enjoy some chinese food around here.	distance&poi_type
3180	which is faster?	distance
3181	when is my optometrist's appointment on the 12th	date&event
3182	seattle.	location
3183	mark on my calendar that i am going to the football game this saturday at 3:30	event&time
3184	get the address to the closest gas station asap.	poi_type
3185	schedule a reminder to take medicine with my brother this month on the 11th at 3pm.	agenda&date&event&party&time
3186	find starbucks	poi
3187	do you have any coffee or tea places near me?	distance&poi
3188	please tell me what time my yoga activity is and who will be attending. 	event
3189	tomorrow in inglewood will it be windy?	date&location&weather_attribute
3190	how cloudy is it going to be for the next week	date&weather_attribute
3191	please tell me about manhattan for next week.	date&location&weather_attribute
3192	when's my next scheduled yoga class	event
3193	thank you.	event
3194	are there clear skies in grand rapids now?	date&location&weather_attribute
3195	what day and time is my dentist appointment?	event
3196	what's the temperature going to be like on friday	date
3197	please check the temperature for menlo park. thanks!	location
3198	what shopping centers are around?	poi_type
3199	get the address to the nearest shopping mall.	distance&poi_type
3200	is that the fastest route?	distance
3201	find the nearest parking lot	distance&poi_type
3202	which one is it the quickest route to reach?	traffic_info
3203	show me all information regarding my upcoming dentist appointment. 	event
3204	take me to a fast food restaurant	poi_type
3205	let's go to the one near me and on the quickest route	distance&traffic_info
3206	what day is the football game	event
3207	locate a place where i could purchase groceries that is near me.	distance&poi_type
3208	which one has the quickest route?	traffic_info
3209	car i'm looking for a pizza restaurant within 4 miles of my actual position, possibly with no traffic	distance&poi_type&traffic_info
3210	take me home. 	poi&poi_type
3211	please avoid all heavy traffic if possible. 	address&poi&poi_type&traffic_info
3212	what is the weather forecast for the weekend	date
3213	seattle, please tell me if it will be warm this week.	date&location&weather_attribute
3214	i need to know if it will be windy in compton this week.	date&location&weather_attribute
3215	schedule a doctors appointment on the 12th	agenda&date
3216	i'm looking for a place to eat can you show me directions to the nearest fast food restaurant	distance&poi_type
3217	could you please show me the quickest route to get there?	distance
3218	what is the time and location of my next conference and who will be attending it?	event
3219	what's the weather forecast for today and tomorrow	date
3220	fresno.	date&location&weather_attribute
3221	set a reminder for yoga on the 2nd with father at 5pm	date&event&party&time
3222	schedule tennis for 4:50 pm on the 12th	date&event&time
3223	what is the time, location, and agenda of my next conference?	event
3224	give me directions to a place to sleep	poi_type
3225	give me the address of westin.	poi
3226	give me the address to the four seasons instead and set the gps to the quickest route.	address&poi
3227	i have a doctor's appointment to go to at 12 pm	event&time
3228	i have it marked for  friday 	time
3229	is it gonna snow during the next week in atherton?	date&location&weather_attribute
3230	please tell me the weather for today and what the weather will be tomorrow	date
3231	atherton	date&location
3232	schedule a yoga activity with alex on august 14th at 1pm.	date&event&party&time
3233	where is the nearest hotel	distance&poi_type
3234	navigate to the nearest coffee shop	distance&poi_type
3235	is starbucks the closest coffee shop?	distance&poi&poi_type
3236	where is cafe venetia?	poi
3237	sounds good, make a route to cafe venetia with no traffic	poi&traffic_info
3238	schedule my eye doctor appointment	event
3239	what time is my doctors appointment and who is attending?	event
3240	what time is my next swimming activity and who will be attending?	event
3241	schedule a reminder for me to take my medicine today with my father at 1pm.	date&event&party&time
3242	where is the closest gas station and what are the directions to get there the fastest?	distance&poi
3243	yes shell sounds great. 	poi
3244	what is the current temperature	date&weather_attribute
3245	alhambra, please.	location
3246	is it gonna be windy in alameda on monday?	date&location&weather_attribute
3247	how hot is it going to be this week	date
3248	downtown chicago, please	location
3249	find the shortest distance to a chinese restaurant nearby	distance&poi_type
3250	ok, give me directions via the shortest distance please. 	distance
3251	where can i go to eat	poi_type
3252	give me the address to the pizza spot.	poi_type
3253	directions to nearest barista	poi_type
3254	give me the address.	poi
3255	navigate fastest route home	poi&traffic_info
3256	i need to schedule a doctor's appointment. 	event
3257	it's at 3 pm next week and my father is joining me.	date&party&time
3258	running out of gas. closest gas station? 	distance&poi_type
3259	yes, please give me directions via a quick route. 	poi&traffic_info
3260	what is the date of my next lab appointment and who will be attending?	event
3261	what time and date is my conference and what is the agenda?	event
3262	find out if it's going to be cloudy next week	date&weather_attribute
3263	compton	date&location&weather_attribute
3264	set a reminder for me for the meeting next week at 5pm with my boss in which we will go over the budget.	agenda&event&party&time
3265	what is the weather like today in tomorrow	date
3266	i need to know what the lowest temperature in compton is today	date&location&weather_attribute
3267	what's the weather going to be like for this week	date
3268	menlo park, please.	date&location&weather_attribute
3269	send me to the nearest gas station	distance&poi_type
3270	does it have the least traffic of all choices?	traffic_info
3271	pick a quick route to get there and send the address on my map please!	address
3272	will it be cloudy in new york on thursday?	date&location&weather_attribute
3273	where and on what day is my meeting, and what is the agenda?	event
3274	what is the weather forecast for wednesday through tuesday of next week	date
3275	please tell me if there will be any drizzle in boston on tuesday.	date&location&weather_attribute
3276	give me directions to the nearest coffee place	distance&poi_type
3277	yes, please, and pick the fastest route too, thank you!	distance&poi
3278	what is the weather forecast for wednesday through tuesday of next week	date
3279	exeter, please: there will be any blizzard?	location&weather_attribute
3280	let me know if there will be snow and ice in the next week's forecast	date&weather_attribute
3281	will it snow in carson?	date&location&weather_attribute
3282	please show me a quick route to come back home, thank you	distance&poi&poi_type
3283	what time and date is my dentist appointment?	event
3284	the one on the 3rd.	date&event
3285	car i need a parking garage in the area, please find something for me	poi_type
3286	plot the quickest route to palo alto garage with details 	distance&poi
3287	what day is my yoga class	event
3288	find the nearest parking lot	distance&poi
3289	schedule a meeting with executive team to discuss the company picnic on the 8th at 7 pm	agenda&date&event&party&time
3290	car i need a quick route to a hospital in the area	distance&poi_type
3291	yes, please, send its address on my map and pick a quick route for me!	distance&poi
3292	this week in exeter will it be hot?	date&location&weather_attribute
3293	is there a rest stop near me?	distance&poi_type
3294	what is the date of my meeting, who will be there, and what time does it start?	event
3295	what are the directions to the nearest chinese restaurant	distance&poi_type
3296	what is the forecast for today's weather	date
3297	atherton.	location
3298	fastest way to get to a nearby coffee place? 	distance&poi_type
3299	yes that sounds good.	distance&poi&poi_type
3300	please let me know the weather forecast for tomorrow	date
3301	fresno, please	location
3302	i need to find a parking garage with no traffic in the route.	poi_type&traffic_info
3303	find me the closest coffee shop on the map	distance&poi_type
3304	set a reminder for yoga next month on the 13th at 6pm with my mom.	date&event&party&time
3305	is there a parking garage near?	distance&poi_type
3306	is there any traffic on the way?	traffic_info
3307	i have a doctor's appointment to get a tooth removed and i have to go	event
3308	what's the weather like on my drive today	date
3309	i want to know if it will be humid in manhattan today.	date&location&weather_attribute
3310	car, remind me to take my medicine at 11 am, with jeff.	event&party&time
3311	remind me about my optometrist appointment on thursday with my brother	date&event&party
3312	set a reminder for me to take my medicine at 10am when i meet with my sister at the end of march.	date&event&party&time
3313	what is the weather like today and tomorrow	date
3314	in compton, please tell me if it will be humid.	location&weather_attribute
3315	what is the date and time of the meeting	event
3316	where can i get coffee	poi_type
3317	find me a nearby tea or coffee shop	distance&poi_type
3318	pick a route with no traffic and let's go there, thank you!	poi&traffic_info
3319	tell me when i have yoga class	event
3320	remind me about my doctor appointment at 9 am today, my sister is coming.	date&event&party&time
3321	when am i supposed to swim tomorrow	time
3322	set a reminder for a meeting with my boss on the 12th of this month at 10am to discuss the budget.	agenda&date&event&time
3323	give me directions to the local starbucks	poi
3324	some other kind of coffee or tea place within 3 miles and with no traffic?	distance&poi_type&traffic_info
3325	send me to the nearest gas station	distance&poi_type
3326	where can i get chinese food?	poi_type
3327	oh no is there any other options?	poi_type
3328	what's the forecast for the city this week	date&location
3329	mountain view	date&location&weather_attribute
3330	is it going to rain in the next 7 days	date&weather_attribute
3331	danville	date&location&weather_attribute
3332	directions to nearest grocery store	distance&poi
3333	that's good! let's go and pick a route with no traffic please	traffic_info
3334	what is my adress?	poi_type
3335	what's the weather in alameda now?	date&location
3336	set reminder for yoga classes on the 12th of this month	date&event
3337	will it be dry in durham today?	date&location&weather_attribute
3338	what is the weather like today	date
3339	for menlo park please. 	date&location
3340	what is the weather going to be like today and tomorrow	date
3341	im in brentwood, i want to know if there will be frost today or tomorrow	date&location&weather_attribute
3342	i need to know when my football activity is and with whom. 	event
3343	please show me the weekly weather report	date
3344	i would like to know the weekly weather for mountain view please. 	date&location
3345	is there going to be snow in boston on monday? 	date&location&weather_attribute
3346	hi, i need to know some information about my upcoming conference, specifically, when and where it will take place, and what will be on the agenda. 	event
3347	find nearby parking areas	distance&poi_type
3348	will it be raining in the next 7 days	date&weather_attribute
3349	mountain view.	location
3350	is it gonna drizzle in durham during the week?	date&location&weather_attribute
3351	will the weather be cloudy next week	date&weather_attribute
3352	new york thanks	date&location&weather_attribute
3353	what is the highest temperature in new york right now	date&location&weather_attribute
3354	tell me the weather report for tuesday in san mateo	date&location
3355	where's the nearest produce stand	distance&poi_type
3356	yes please.	poi
3357	navigate to the nearest place to get coffee	distance&poi_type
3358	where can i get gas?	poi_type
3359	show me traffic for going home	poi
3360	no, thanks, i remember it, just avoid all heavy traffic and show me the route on screen	traffic_info
3361	i have a dinner on tuesday	date&event
3362	it is at 3pm	time
3363	the dinner will be with jon.	event&party
3364	schedule me a meeting today at 3pm, with management to onboard new members.	agenda&date&event&party&time
3365	car find me a local chinese restaurant with the fastest route.	distance&poi_type
3366	please send it on my screen along with the fastest route, thank you!	distance
3367	what is the weather forecast for wednesday through tuesday of next week	date
3368	will you find out if it will be cloudy in new york on tuesday please	date&location&weather_attribute
3369	find out the date and time for my dentist appointment	event
3370	show directions for the nearest grocery store	distance&poi_type
3371	perfect, give me the address.	address
3372	tell me how hot it's going to be in the forecast for the weather	weather_attribute
3373	give me the info for carson tomorrow	date&location
3374	can you please take me to a coffee house	poi_type
3375	is there any other coffee shop near me?	distance&poi_type
3376	what time is my swimming activity and who is going to be attending?	event
3377	tell me the time and date that my next tennis game is scheduled at	event
3378	remind me about my optometrist appointment on thursday at 11 am, my aunt is coming	date&event&party&time
3379	what is the weather like in danville next week?	date&location
3380	the weekly forecast please	location
3381	is it gonna be humid in inglewood during the next week?	date&location&weather_attribute
3382	which one will be the temperature in compton today and tomorrow?	date&location&weather_attribute
3383	i have to go grocery shopping can you give me directions to the nearest grocery store	distance&poi
3384	pick a quick route to go there and send the address on my map please!	address
3385	will it be stormy this weekend in cleveland?	date&location&weather_attribute
3386	what's the weather going to be like today and tomorrow	date
3387	will it be raining in inglewood today or tomorrow?	date&location&weather_attribute
3388	please, set a reminder for a meeting at 1pm with hr to sign the nda!	agenda&event&party&time
3389	find me the closest coffee shop on the map	distance&poi_type
3390	where is there pizza?	poi_type
3391	which is faster to get to?	distance
3392	what's the weekly forecast	date&weather_attribute
3393	i want to know if it will drizzle in cleveland this week	date&location&weather_attribute
3394	redwood city, what's the forecast for today and tomorrow?	date&location&weather_attribute
3395	remind me that i have a meeting at work on the 12th at 5 pm in conference room 100	date&event&room&time
3396	schedule a conference with the executive team at 5 pm on the 6th .	date&event&party&time
3397	will it be frost in alhambra in next 48 hours?	date&location&weather_attribute
3398	on friday will there be clear skies in oakland?	date&location&weather_attribute
3399	what is the local weather forecast for this week	date&location
3400	what is the lowest temperature in danville this week?	date&location&weather_attribute
3401	find me the nearest grocery store	distance&poi_type
3402	schedule a swimming activity with alex for the 13th at 1pm.	date&event&party&time
3403	where is the closest rest stop?	distance&poi_type
3404	set a reminder for lab work on the 12th	date&event
3405	check doctor's appointment date	event&time
3406	will it drizzle in redwood city on tuesday?	date&location&weather_attribute
3407	is it going to be humid in camarillo on tuesday?	date&location&weather_attribute
3408	take me to the nearest cafe	distance&poi_type
3409	let's go to peets coffee. 	distance&poi&poi_type
3410	what time is the tennis activity and who is attending?	event
3411	search for nearby starbucks	distance&poi_type
3412	is there another coffee place within 4 miles?	distance&poi_type
3413	give me directions to philz please.	poi
3414	can you give me directions to a fast food place that serves pizza	poi_type
3415	yes please.	poi
3416	is it the nearest to my current location?	distance
3417	is there no traffic on the route to pizza my heart?	poi&traffic_info
3418	is there a nearby pizza place with no traffic on the way?	traffic_info
3419	set a reminder for dinner at 7pm on the 6th with my brother.	date&event&party&time
3420	is it gonna be hot in atherton today and tomorrow?	date&location&weather_attribute
3421	what time do the lab results come in	event
3422	will it hail in brentwood?	location&weather_attribute
3423	get me directions to the closest starbucks	distance&poi
3424	how about any coffee shop.	poi
3425	find the nearest gas station near my location.	poi_type
3426	get me the address to it.	address&poi
3427	where can i get groceries?	poi_type
3428	is that the nearest grocery shop?	distance&poi_type
3429	will there be rain in grand rapids on tuesday? 	date&location&weather_attribute
3430	what is the weather next week	date
3431	inglewood	location
3432	what is the date and time of my next swimming activity?	event
3433	the one on the 8th.	date&event
3434	car what is the weather going to be like in the next several days	date
3435	san francisco	location
3436	tuesday please.	date
3437	car is there any grocery store near me?	distance&poi_type
3438	which has less traffic?	traffic_info
3439	get me the address of a coffee or tea place around me that has no traffic	poi_type&traffic_info
3440	can you schedule a football game next month on the 13th?	date&event
3441	at 6 pm and alex will be going.	party&time
3442	remind me when my next doctor's appointment is	event
3443	does the local forecasts say it'll be cloudy	weather_attribute
3444	compton, it it gonna be cloudy on monday?	date&location&weather_attribute
3445	any pizza close?	poi_type
3446	what time is my dinner reservation	event
3447	give me the weather for next week	date
3448	exeter please.	location
3449	give me the full weekly weather forecast	date
3450	i need to know the weekly forecast for inglewood, and i especially need to know if it will be foggy. 	date&location&weather_attribute
3451	set a reminder for the lab request on 12th	date&event
3452	that will do, thanks. 	date&event
3453	what is the date for my doctor appointment and who is attending?	event
3454	show me this week's forecast	date
3455	i want to know if there will be frost in downtown chicago this week.	date&location&weather_attribute
3456	what is the weather today	date
3457	menlo park.	location
3458	show me the way to some chinese food	poi_type
3459	it sounds good! please show me the address and the fastest route to go there, thank you!	distance
3460	set a reminder to take medicine at 9am on the 12th of this month with alex.	date&event&party&time
3461	will there be any frost in fresno this week?	date&location&weather_attribute
3462	get me directions to a local cafe	poi_type
3463	do you have the quickest route available?	distance
3464	is it supposed to rain this week	date&weather_attribute
3465	san francisco	location
3466	what is the date of my next doctor appointment and who will be attending?	event
3467	where can a girl get some pizza around here?	distance&poi_type
3468	please give me the address and directions via the route that avoids all heavy traffic to pizza chicago.	poi&traffic_info
3469	i want coffee.	poi_type
3470	tell me about the one near my current location	distance
3471	then pick the fastest route and let's go there, thank you!	distance&poi
3472	what is the date and time of my next exercise class	event
3473	schedule a conference with the boss on the 2nd at 2pm.	date&event&party&time
3474	i'd love to go shopping are there any malls nearby	distance&poi_type
3475	then let's go there, thank you, please pick a quick route for me	distance&poi
3476	tell me the closest place to get a cup of hot tea	distance&poi_type
3477	please pick a route with no traffic and send me the address on screen, thank you!	poi&traffic_info
3478	when should i take my medicine next	agenda&date&time
3479	will there be dew in durham tomorrow? 	date&location&weather_attribute
3480	schedule my tennis class	event
3481	what is the agenda of my meeting today	event
3482	thanks	agenda&date&event
3483	is it gonna be windy in camarillo on sunday?	date&location&weather_attribute
3484	what is the address for my house? 	address&poi
3485	tell me the fastest route there	distance
3486	where is the nearest rest stop?	distance&poi_type
3487	could you please show me the quickest route to get there?	distance
3488	can you give me directions to the nearest starbucks	distance&poi
3489	how about the address to any coffee shop.	poi_type
3490	the one with the quickest route.	distance
3491	okay, give me the address to philz and set navigation to find the quickest route there.	distance&poi
3492	find a gas station that is not farther than 3 miles away.	distance&poi_type
3493	ok, where is it and i need a quick route there.	distance
3494	address for starbucks please. 	poi
3495	which one is it the fastest route to go there? could you show it on my map?	traffic_info
3496	schedule a tennis match for 3pm this week with jeff.	date&event&party&time
3497	when is my doctors appointment and who is going?	event
3498	will it rain next week	date&weather_attribute
3499	i need to know about carson please. 	date&location&weather_attribute
3500	does the forecast say it will snow	weather_attribute
3501	san jose, will it snow on friday?	date&location&weather_attribute
3502	schedule my doctors appointment on the 12th	date&event
3503	i need the closest parking garage. 	poi_type
3504	let's go to dish parking. 	poi
3505	tell me what the temperature will be like for the next week	date&weather_attribute
3506	i need weekly temperature information for the city of corona.  	date&location&weather_attribute
