	x	y
2351	will the weather be overcast in atherton over the next 7 days?	date&location&weather_attribute
2352	what is the 7 day forecast for atherton next week?	date&location
2353	what are the directions for the nearest shopping center without traffic?	distance&poi_type&traffic_info
2354	yes, please give me the address and directions via a route that avoids as much heavy traffic as possible. 	distance&poi_type&traffic_info
2355	tell me the temperature for this week	date&weather_attribute
2356	manhattan	location
2357	set a reminder for the conference	event
2358	find nearest chinese restaurant	distance&poi
2359	let's go there, just pick the fastest route	traffic_info
2360	when is the meeting	event
2361	i want pizza.	poi_type
2362	yes please find the quickest route. 	traffic_info
2363	please give me the address and load directions. thank you. 	poi
2364	can you give me directions to the grocery store	poi_type
2365	is it going to snow any this week	date&weather_attribute
2366	alhambra.	location
2367	remind me that i have a meeting tomorrow	date&event
2368	car i want to do some shopping in some local shopping center: is there any nearby?	distance&poi_type
2369	what is the address?	distance&poi&poi_type
2370	set a reminder for a meeting to sign the nda on the 7th at 2pm with the vice president 	agenda&date&event&party&time
2371	set reminder for yoga classes on the 12th of this month	agenda&date&event
2372	i need the reminder at 7pm for the yoga class on december 12th.	date&event
2373	tell me when i'm going swimming	event
2374	schedule a tennis activity with alex on the 13th at 11am.	date&event&party&time
2375	what time is my yoga appointment	event
2376	what time is my football activity and who is attending?	event
2377	show me the weather for the next 7 days	date
2378	find out if there will be anyt frost in camarillo 	location&weather_attribute
2379	what is the weather for today	date
2380	downtown chicago	location
2381	find a chinese take-out spot near my location.	distance&poi_type
2382	which has the least traffic?	traffic_info
2383	san francisco on sunday.	date&location
2384	get directions to the nearest hotel	distance&poi_type
2385	what is the address of the nearest rest stop?	distance&poi_type
2386	check out my appointment	event
2387	doctor appointment, i need to find out the agenda. 	agenda&event
2388	find out what time my eye doctor appointment is	event
2389	tell me how to get to shopping mall	poi_type
2390	will it be misty in alhambra on monday?	date&location&weather_attribute
2391	is there going to be dew in san francisco on thursday?	date&location&weather_attribute
2392	give me this week's high temperature	date&weather_attribute
2393	redwood city	location
2394	will it be foggy in alameda on saturday?	date&location&weather_attribute
2395	get me the home address of my friend that is the closest to my location.	distance&poi_type
2396	please pick the quickest route to go there and send the info on my screen	distance
2397	schedule an optometrist appointment next friday at 4 pm with tom	date&event&party&time
2398	when am i taking my medicine	event
2399	jon	event&party
2400	find me a hospital with the least amount of traffic on the way.	poi_type&traffic_info
2401	yes i need the fastest route please.	distance&poi
2402	what is the date and time of the meeting	event
2403	check and see if it will be humid in inglewood on tuesday	date&location&weather_attribute
2404	what's the weather like in downtown chicago	location
2405	set a reminder for the 15th at 6pm. conference with the executive team. 	agenda&date&event&time
2406	schedule a meeting at 4pm today, with the boss, to discuss dress code	agenda&date&event&party&time
2407	can you give me the weather this week for new york city	date&location
2408	please schedule a dentist appointment at 3pm the 7th, with aunt.	date&event&party&time
2409	get directions to the nearest parking garage	distance&poi_type
2410	will it hail in menlo park on monday?	date&location&weather_attribute
2411	i want coffee.	poi_type
2412	what is the address?	address
2413	what is the traffic like to that location?	traffic_info
2414	no, i would like to avoid any heavy traffic please.	traffic_info
2415	will there be rain in the forecast for cleveland for the next 7 days?	date&location
2416	where do i live?	poi_type
2417	what time is my next football activity and who will be attending?	event
2418	how long to the nearest grocery store	poi_type
2419	i need to schedule a conference room	event
2420	show me nearby parking	distance&poi_type
2421	can you find the quickest route to get there?	distance
2422	where can i eat pizza?	poi_type
2423	i'm looking for a place to eat can you show me directions to the nearest fast food restaurant	distance&poi_type
2424	yes please, the address.	poi
2425	is this within 3 miles? if so please give me route details.	distance
2426	is there any rain in the local forecast	weather_attribute
2427	i would like to know for san mateo.	location&weather_attribute
2428	i need to find out the date and time of my dentist appointment, please. 	event
2429	check the weather for today	date
2430	is it raining in exeter today?	date&location&weather_attribute
2431	remind me about meeting later	event
2432	the meeting is at 7 pm	event&time
2433	please give the address and directions via the fastest route to a hospital. 	distance&poi_type
2434	where is my home?	poi&poi_type
2435	what is the current high temperature in atherton? 	date&location&weather_attribute
2436	schedule a dentist appointment with ana for the 15th of this month at 2pm.	date&event&party&time
2437	find weekly weather forecast	date&weather_attribute
2438	durham, will it be cloudy this week?	date&location&weather_attribute
2439	please tell me about the time and date my next meeting is scheduled for and what i hope to accomplish it	event
2440	where's parking	poi_type
2441	where can i get groceries?	poi_type
2442	please pick the quickest route to get there, thank you!	distance&poi
2443	is snow forecasted this week	date&weather_attribute
2444	will it snow in redwood city?	location&weather_attribute
2445	set a reminder for tennis at 2 pm with tom next month on the 13th.	date&event&party&time
2446	where is the nearest grocery store	distance&poi_type
2447	i need to go home and avoid the heavy traffic. 	poi_type&traffic_info
2448	am i more than 3 miles away right now?	distance
2449	ok avoid all heavy traffic with the fasest route home	distance&poi&poi_type&traffic_info
2450	what's the temperature going to be this week	date&weather_attribute
2451	fresno	location
2452	show me directions to the nearest starbucks	distance&poi&poi_type
2453	yes please that sounds good. 	distance&poi&poi_type
2454	schedule a meeting for 6 pm with hr	event&party&time
2455	the meeting is one week from today	date&event
2456	add tennis on wednesday at 5 to my calendar	agenda&event&time
2457	yes, set a reminder for tennis activity at 5 pm on wednesday at 3pm.	event&time
2458	what time do i need to take my medicine? 	event
2459	set a reminder for dentist appointment at 5 pm on the 2nd with ana. 	date&event&party&time
2460	find out the date and time for my swimming activity. 	event
2461	find me a place where i can buy coffee or tea	poi_type
2462	yes sounds good. 	poi
2463	please pick the quickest available route and send the info on my screen	address&distance&poi&poi_type&traffic_info
2464	get the address to my home that is within 3 miles and hurry.	address&poi&poi_type
2465	who is attending my swimming activity and when is it?	event
2466	find me a place i can go to sit and drink coffee or tea	poi_type
2467	yes, please, if it has the fastest route to it.	poi&poi_type
2468	yes let's try the one with moderate traffic. 	poi&traffic_info
2469	any chinese restaurant around me?	distance&poi_type
2470	ok, please direct me via the fasted available route. 	distance
2471	schedule a football activity with martha on sunday at 4pm.	date&event&party&time
2472	is it supposed to rain this week	date&weather_attribute
2473	the big apple, new york city!	date&location&weather_attribute
2474	give me the 7 day weather forecast	date
2475	i need to see if it will rain this week in manhattan please car. 	date&location&weather_attribute
2476	what is the time and date for my yoga activity?	event
2477	will it be foggy in seattle today and tomorrow?	date&location&weather_attribute
2478	thank you car!	date&location&weather_attribute
2479	what time is my meeting, what is the agenda, and who is going?	event
2480	find me the best parking spot	poi_type
2481	please guide me to the closest parking garage. 	distance&poi_type
2482	car i need a hotel, please find something near my current location	distance&poi_type
2483	please pick a route with no traffic and let's go there, thank you!	address&distance&poi&poi_type&traffic_info
2484	what day and time is my football activity?	event
2485	what is the date and time of my next swimming activity?	event
2486	set a reminder for doctor's appointment	event
2487	did you get the time or date?	date&time
2488	is it going to snow this week	date&weather_attribute
2489	san francisco.	date&location&weather_attribute
2490	remind me about dinner tonight	date&event
2491	dinner is at 7 pm tonight.	date&event&time
2492	what is the weather like today and tomorrow	date
2493	is the weather overcast in seattle today?	date&location&weather_attribute
2494	let me know if there will be snow and ice in the next week's forecast	date&weather_attribute
2495	in mountain view, please	date&location&weather_attribute
2496	where can i get gas?	poi_type
2497	pick the quickest one to reach, the one in the shortest distance	distance
2498	where is chevron?	poi
2499	yes, set the gps to that with route details and the quickest route and shortest time	distance&poi&traffic_info
2500	what's the weather like today	date
2501	brentwood, please. what is today's temperature?	date&location&weather_attribute
2502	look at today and tomorrow and tell me if it will be cloudy in compton	date&location&weather_attribute
2503	where can i get chinese food?	poi_type
2504	please pick the fastest route to get there and send the info on the gps, thank you!	poi
2505	locate a parking garage around my current location.	poi_type
2506	is it going to snow today	date&weather_attribute
2507	i need to know this for redwood city, today please. 	date&location
2508	set a reminder that i have a lab appointment with my aunt next wednesday at 1pm	date&event&party&time
2509	mountain view for the next 7 days please. 	date&location
2510	will it be overcast?	weather_attribute
2511	check to see if it will be windy in brentwood the next few days	date&location&weather_attribute
2512	car what is the date and time of my next appointment with my optometrist	event&room
2513	i need a no traffic route to a rest stop. 	poi_type&traffic_info
2514	i feel like some coffee where's the nearest place	distance&poi_type
2515	it sound good! please pick a quick route and show me the map on screen	distance
2516	what's the weather like today and tomorrow	date
2517	in durham, will it rain?	date&location&weather_attribute
2518	set a reminder for a conference with vice president at 3 pm on saturday. 	date&event&party&time
2519	will it be cloudy in oakland this week?	date&location&weather_attribute
2520	what is the weather like today	date
2521	i need today's weather for cleveland, and i need to know if it will be misty. 	date&location&weather_attribute
2522	is there any stormy weather predicted in corona over the next 48 hours?	date&location&weather_attribute
2523	find out the parties attending and the time for my soonest lab appointment. 	event
2524	car my home should be around here, please send me the info on screen, i must be a little drunk..	distance&poi&poi_type
2525	what is the address?	address&poi
2526	please give me the address and directions to my friend's house by the fastest possible route without heavy traffic.	distance&poi_type&traffic_info
2527	what is the weather for next week	date
2528	i will traveling to mountain view so i need information for there please.	date&location
2529	for the whole week, please!	date&location
2530	will it be cloudy this week	date&weather_attribute
2531	please check for san francisco.	date&location&weather_attribute
2532	set up a group meeting at the conference room for next week	event&room
2533	start listening what will be the weather for the week	date
2534	durham please.	location
2535	where can i find a rest stop?	poi_type
2536	set gps for the quickest route please.	distance
2537	will it be cloudy	weather_attribute
2538	san francisco please.	location&weather_attribute
2539	please give me the address and directions via the shortest distance to a rest stop around here. 	distance&poi_type
2540	schedule a conference with the sales team on the 6th at 9am.	date&event&party&time
2541	how is the weather this week	date
2542	mountain view, is it supposed to rain?	location&weather_attribute
2543	get me directions to the nearest shopping mall	distance&poi_type
2544	i wish we could avoid the traffic but i guess this will do. what's the address?	traffic_info
2545	please give me the address and directions for a hotel within 4 miles of here, avoiding all heavy traffic. 	distance&poi_type&traffic_info
2546	i need to set up a reminder to go to the dentist	agenda&event&room
2547	3pm on tuesday. 	event&room&time
2548	set a reminder for the conference	event
2549	1 pm	time
2550	is it going to be cloudy this week	date&weather_attribute
2551	alameda, please.	date&location&weather_attribute
2552	what is the weather going to be like tomorrow show me the 7 day forecast	date
2553	sorry, i actually need to know what the highest temperature will be in corona tomorrow. 	date&location&weather_attribute
2554	confirm that the meeting for the 12th this month is on at approximately 5 pm	date&event&time
2555	will i be able to make it to my meeting on time	event
2556	what is the highest temperature in san jose on thursday?	date&location&weather_attribute
2557	i need a reminder set for football activity on august 22th at 5 pm with jeff. 	date&event&party&time
2558	please set a conference reminder. i need it at 10 am, the tenth, with my vice president. 	date&event&party&time
2559	i need a quick route to a gas station. 	distance&poi_type
2560	please schedule my yoga class at 1pm on thursday with jon.	event&party&time
2561	what's the weather forecast in new york	location
2562	okay, will it be humid in new york next week?	date&location&weather_attribute
2563	can you find out the date and parties attending for my tennis activity? 	event
2564	what's the forecast for the weather today	date
2565	i want to know chicago's weather. 	location
2566	find the nearest gas station near my currently location.	distance&poi_type
2567	what's the weather going to be like today	date
2568	will it drizzle in iniglewood?	location&weather_attribute
2569	what is the weather like in new york this week	date&location
2570	what's the forecast in carson for this weekend?	date&location
2571	is it gonna rain in manhattan today and tomorrow?	date&location&weather_attribute
2572	navigate to my friend's home please	poi
2573	actually i need to go home, the quickest route please. 	poi&traffic_info
2574	thanks.	address&distance&poi&poi_type&traffic_info
2575	ok well set the gps to there please.	address&distance&poi&poi_type&traffic_info
2576	when and where is my next meeting	event
2577	i have a doctor appointment next month on the 13th at 11 am with tom. please set a reminder. 	date&event&party&time
2578	tell me the weather for this week	date
2579	i want to know if it will be warm in boston	location&weather_attribute
2580	schedule a meeting for 2 pm	event&time
2581	set a reminder for an optometrist appointment with jeff later this week at 3pm	date&event&party&time
2582	saturday. thanks.	date
2583	schedule a optometrist appointment with tom today at 7pm.	date&event&party&time
2584	yes, today. 	date
2585	i want to know if there is a blizzard in the forecast for san jose for this weekend. 	date&location&weather_attribute
2586	will it be cloudy this week	date&weather_attribute
2587	san mateo.	location
2588	what is the weather for today	date
2589	i need to know the temperature in san francisco today.	date&location&weather_attribute
2590	please give me directions to the nearest starbucks	distance&poi
2591	check calendar for when my doctor's appointment is	event
2592	what's the quickest route to the hospital?	distance&poi_type
2593	i would rather go to stanford express please. what's the address?	poi
2594	make a note to find a restaurant to eat at at 5 pm on the 12th	date&event&time
2595	i would like to schedule a meeting on the 12th what is my agenda for that day	date&event
2596	will it snow next week in atherton?	date&location&weather_attribute
2597	will it be warm on sunday in alameda?	date&location&weather_attribute
2598	will it snow this week	date&weather_attribute
2599	manhattan.	location
2600	where can i get chinese food?	poi_type
2601	please direct me via the quickest route. 	distance
2602	show the route to my friend's house	poi&poi_type
2603	is it raining next week	date&weather_attribute
2604	exeter please, find out if there is going to be rain next week.	location&weather_attribute
2605	is it going to rain sometime this week	date&weather_attribute
2606	i need to know about san mateo. 	location
2607	i need to schedule a lab appointment. 	event
2608	it is at 1pm on wednesday with sister. 	date&event&party&time
2609	take me to my friend's house	poi_type
2610	yes, please, i wanted to mean my home.. just avoid all heavy traffic!	poi&poi_type&traffic_info
2611	would you confirm the address of home, please?	address
2612	where can i get groceries?	poi_type
2613	how do i get to the nearest restaurant	poi_type
2614	sure, thanks, pick a quick route too please	traffic_info
2615	set a reminder for dinner at 5pm on the 6th with jeff.	date&event&party&time
2616	schedule a swimming activity at 9am on august 22nd with ana.	date&event&party&time
2617	is it overcast now in grand rapids?	date&location&weather_attribute
2618	i want to do some shopping. direct me to a mall, but in a way that avoids all traffic. 	poi_type&traffic_info
2619	ok, please give me the address and direct me via the route that avoids most traffic.	traffic_info
2620	remind me about a optometrist appointment on tuesday at 2 pm, my sister will be coming	date&event&party&time
2621	locate a place that serves pizza.	poi_type
2622	which is closer?	distance
2623	ok let's go to pizza chicago then since it's closest. 	distance&poi
2624	car find me a grocery store within 2 miles from my location with the shortest distance.	distance&poi_type
2625	yes, please direct me via the shortest distance. 	address&distance&poi&poi_type
2626	where does my friend live?	poi_type
2627	yes and please take me the fastest way?	traffic_info
2628	which one is gonna be the lowest temperature today in new york?	location&weather_attribute
2629	who is coming to my doctor appointment with me?	event
2630	i need the fastest route home. 	distance&poi_type
2631	tell me the weather forecast for this week	date
2632	manhattan, please. there will be clear skies?	location&weather_attribute
2633	directions to local hotel	poi_type
2634	yes that sounds perfect. 	poi
2635	yes, set it to the quickest route.	distance&poi
2636	will it rain this week	date&weather_attribute
2637	corona.	location
2638	how's the weather in new york	location
2639	car i need a gas station!	poi_type
2640	can you set gps and navigate us there?	address&distance&poi&poi_type
2641	what's the weather forecast for the next week	date
2642	i am needing information for mountain view please.	date&location
2643	look for parking	poi_type
2644	let's avoid all heavy traffic and send me its address on screen please	traffic_info
2645	where can i get chinese food?	poi_type
2646	i need to know if it will be cloudy in san jose over the next seven days	date&location&weather_attribute
2647	what time is dinner and who is coming?	event
2648	the one on the 20th.	date&party&time
2649	what's the weather going to be like today and tomorrow	date
2650	can you tell me if it's going to be hot in mountain view?	date&location&weather_attribute
2651	car i need to fill your gas, please show me a gas station near me in the direction we're actually driving	distance&poi_type
2652	how is the traffic there? i need to have no traffic. 	traffic_info
2653	find a chinese joint that is within 3 miles of my location.	distance&poi_type
2654	will it be foggy in menlo park today?	date&location&weather_attribute
2655	what's the weather like in grand rapids	location
2656	will it be cloudy on wednesday?	date&weather_attribute
2657	what is the address of  my friend's house?	poi_type
2658	pick the quickest one please and avoid all heavy traffic on our route	traffic_info
2659	what is the highest temperature in manhattan in the next 2 days?	date&location&weather_attribute
2660	find out when my next conferences	event
2661	is there a chance of snow in this weeks weather forecast	date
2662	downtown chicago please.	location
2663	get me the address to the closest gas station.	distance
2664	get me the weather forecast for the next 7 days	date
2665	i'm currently in cleveland.	date&location
2666	can you check the time and date of my dinner?	event
2667	i need you to set a schedule for a meeting at 3pm, the 5th with vice president to onboard new members	agenda&date&event&party&time
2668	add meeting in conference room 102 the calendar	event&room
2669	set a reminder for dinner at 1pm on the 10th with my father. 	date&event&party&time
2670	what time is my optometrist appointment and who will be attending it?	event
2671	please give me an address and directions by the fastest route with no traffic to a chinese restaurant. 	distance&poi_type&traffic_info
2672	yes please. 	distance&poi_type&traffic_info
2673	reminder for optometrist. 	event
2674	it's at 6 pm on the 11th with my brother	date&event&party&time
2675	i need it for seattle.	location
2676	what time is my doctor appointment and who is attending with me?	event
2677	good evening car, set a reminder about a swimming activity at 3pm, december 10th with aunt, set it for 1pm.	date&event&party&time
2678	what time should i get my shot this afternoon	date&event
2679	set a schedule for a meeting at 5pm, 6th of this month with hr to sign the nda.	agenda&date&event&party&time
2680	will it be clear in san mateo on wednesday?	date&location&weather_attribute
2681	can you please take me to a coffee house	poi_type
2682	the one with the quickest route which looks like philz. 	distance&poi
2683	yes please. 	poi
2684	what's the temperature outside like today	date&weather_attribute
2685	i'm in new york	location
2686	car is it going to snow today	date&weather_attribute
2687	chicago.	location
2688	how warm is it outside right now	date&weather_attribute
2689	compton	date&location&weather_attribute
2690	will it be dry in durham on sunday? 	date&location&weather_attribute
2691	i am hungry. where is there some chinese food close by? 	distance&poi_type
2692	what are the directions to the nearest hospital	distance&poi_type
2693	what is the address of standford childrens health?	poi
2694	please give me an address and directions via the quickest route to a parking garage near me. 	distance&poi_type&traffic_info
2695	yes, please set directions via a quick route. 	distance&poi
2696	give me directions to a coffee shop	poi_type
2697	pick the best location with the quickest route and send me the address on screen, please	distance
2698	what grocery stores are around?	poi_type
2699	which has less traffic?	traffic_info
2700	what chinese food options are there?	poi_type
2701	which has less traffic?	traffic_info
2702	remind me about my son's football practice at 2 tomorrow	date&event&time
2703	set a reminder about my swim meet next wednesday at 3 pm	date&event&time
2704	is it raining in grand rapids currently?	date&location&weather_attribute
2705	i need to find a gas station that fast to get to.	poi_type
2706	what's the weather forecast going to be for each day this upcoming week is it going to snow	date&weather_attribute
2707	new york city, more specifically manhattan.	location
2708	what is the date and time of my next football activity? 	event
2709	check to see if i have any meetings or conferences in the near future	agenda&date
2710	car what is the temperature going to be today and tomorrow	date&weather_attribute
2711	alhambra, please	location
2712	car i'd like to eat in a pizza restaurant: which one is the nearest?	poi_type
2713	what is the date of my next dentist appointment and who will be attending it with me?	event
2714	car what is the temperature going to be today and tomorrow	date&weather_attribute
2715	boston	date&location&weather_attribute
2716	car, schedule a reminder for a doctor's appointment at 4pm, the 7th with tom. 	date&event&party&time
2717	remind me to take my medicine with ana at 2pm, august 3.	date&event&party&time
2718	show me directions to the nearest mall	distance&poi_type
2719	is it supposed to rain in brentwood today or tomorrow?	date&location&weather_attribute
2720	what's the temperature outside like today	date&weather_attribute
2721	manhattan please	date&location&weather_attribute
2722	what is the weather forecast for the next 7 days	date
2723	carson, please	location
2724	what is the weather like this week	date
2725	will it be hot in grand rapids this week?	date&location&weather_attribute
2726	get me directions to a local cafe	poi_type
2727	please give me the address and directions to the coffee shop closest to me. 	distance&poi_type
2728	please pick the route with the shortest distance and let's go there!	address&distance&poi&poi_type
2729	car i need to get to a gas station: is there any around me?	poi_type
2730	could you please pick a route to avoid all heavy traffic?	traffic_info
2731	please give me an address and directions by the route that avoids heavy traffic. thank you. 	distance&poi&poi_type&traffic_info
