	x	y
0	where's the nearest parking garage	distance&poi_type
1	yes, please set directions via a route that avoids all heavy traffic if possible. 	poi&traffic_info
2	where is the nearest gas station?	distance&poi_type
3	show me the closest location where i can get chinese food	distance&poi_type
4	ok, please give me an address and directions via a route that avoids all heavy traffic. 	traffic_info
5	what time is dinner and who is it with?	event
6	schedule dentist appointment	event
7	it is on sunday at 2 pm.	date&time
8	check forecast for new york	location
9	will it be overcast on friday?	date&weather_attribute
10	will it be warm in camarillo over the next 2 days?	date&location&weather_attribute
11	what's the highest temperature for this week	date&weather_attribute
12	menlo park, please	date&location&weather_attribute
13	will there be hail in mountain view today?	date&location&weather_attribute
14	will the weather be warm in menlo park on sunday?	date&location&weather_attribute
15	what is the weather like today and tomorrow	date
16	i need to know if there is a blizzard in redwood city today.	date&location&weather_attribute
17	get me directions to the nearest shopping mall	distance&poi_type
18	remind me that i have a meeting at work on the 12th at 5 pm in conference room 100	date&event&room&time
19	where are the nearest coffee shops	distance&poi_type
20	please give me an address and directions to the peets coffee, and take the fastest route available. 	distance
21	what is the date of football and who is coming?	event
22	will it be stormy in redwood city on wednesday?	date&location&weather_attribute
23	is it going to snow today	date&weather_attribute
24	san mateo please.	location
25	what day and time is my yoga class?	event
26	is the weather cloudy right now	date
27	alameda.	location
28	will the weather be hail in alhambra during the next seven days?	date&location&weather_attribute
29	schedule a yoga activity with tom on the 8th at 2pm.	date&event&party&time
30	i need to find the shortest route to the hospital.	distance&poi_type
31	give me the closest fast food restaurant	distance&poi_type
32	sure find the fastest route to a pizza place that is within 3 miles of me.	distance&poi_type
33	yes, please!	poi
34	what is the date of my nextt dentist appointment and who will be attending it?	event
35	is it going to rain at all this upcoming week	date&weather_attribute
36	redwood city	date&location&weather_attribute
37	is there a nearby rest stop?	distance&poi_type
38	which has the least amount of traffic at the moment.	traffic_info
39	what is the address for keen?	poi
40	give me the address of the nearest shopping center to me, with the fastest route to it	distance&poi_type
41	what is the weather like today in tomorrow	date
42	will it be cloudy in compton today?	date&location&weather_attribute
43	tell me the time of today's meeting	event
44	find me a gas station that i can get to the quickest without any traffic	poi&traffic_info
45	ok, please give me directions via the fastest route. 	distance
46	where does my friend live?	poi_type
47	is that the fastest route?	distance
48	show me traffic for going home	poi_type
49	then pick the fastest route and set the gps to go there, thank you!	address&poi&poi_type&traffic_info
50	will it be dry in fresno on sunday?	date&location&weather_attribute
51	car i'm desiring to have pizza: is there any restaurant within 2 miles?	distance&poi_type
52	search hotels near me	distance&poi_type
53	find an alternate route please.	distance&poi&poi_type&traffic_info
54	set a reminder for my conference call tomorrow	date&event
55	tomorrow at 2 pm.	date&time
56	take me to the parking garage closest to my destination	distance&poi_type
57	uhh ok well i still need to park so what's the address?	distance&poi&poi_type
58	where can i get coffee	poi_type
59	set gps for the fastest route to palo alto cafe.	poi
60	schedule meeting. 	event
61	please set it for the 13th at 11am. it is going to be with management and to discuss our company picnic. thank you.	agenda&date&event&party&time
62	what is the weather like in new york city	location
63	what will the temperature be on thursday?	date&weather_attribute
64	can you find me the fastest route to a pizza restaurant?	poi_type&traffic_info
65	give me the address and the details for the fastest route there, please. 	distance&poi&poi_type&traffic_info
66	i have a meeting tomorrow at 5 pm remind me 10 minutes before hand and attach my agenda to the calendar at 3	agenda&date&event&time
67	does the forecast say it will snow	weather_attribute
68	i need to know about compton for my trip. 	location
69	please check if it will snow today or tomorrow	date&location&weather_attribute
70	i really need to have an appointment scheduled for tennis on the 7th at 11 am.	date&event&time
71	where's the closest place to park	distance&poi_type
72	i need to find a shopping center. 	poi_type
73	yes please.	poi
74	is it raining today in grand rapids?	date&location&weather_attribute
75	when is my football activity and who is going with me?	event
76	find out if it's supposed to rain	weather_attribute
77	i'm interested in fresno.	location
78	what grocery stores are here?	poi_type
79	i'm in pain navigate me to the nearest hospital	distance&poi_type
80	pick the fastest to reach on the quickest route	distance
81	search for nearby starbucks	distance&poi
82	how about other coffee?	poi_type
83	will it be windy in redwood city today?	date&location&weather_attribute
84	what's the weather forecast in new york	location
85	i need to know what the lowest temperature will be in new york in the next few days.	date&location&weather_attribute
86	set a reminder	agenda
87	i need to see the optometrist, set it for 7 pm on august 12th, please. 	date&event&time
88	when do i have dinner planned for	event
89	set a reminder for a lab appointment at 6 pm on sunday, august 8th with sister. 	date&event&party&time
90	in the next 48 hours will it rain in alhambra?	date&location&weather_attribute
91	what is the forecast in my city	location&weather_attribute
92	inglewood, what's the weekly weather looking like?	date&location
93	when is it expected to snow?	weather_attribute
94	what is the weather next week	date
95	mountain view please.	location
96	will it be hot any of the days?	date&weather_attribute
97	set a reminder that i have football at 1pm next wednesday with martha 	date&event&party&time
98	what is the date and time of my doctor appointment?	event
99	on tuesday in san mateo find out if it will be warm	date&location&weather_attribute
100	find out immediately the location, time, and date for my meeting. 	event
101	will it be windy in durham this week?	date&location&weather_attribute
102	give me directions to the nearest shopping center	distance&poi_type
103	can you pick the shortest distance to go there?	distance
104	will there be dew in brentwood this week?	date&location&weather_attribute
105	what time and date is my lab appointment?	event
106	give me the forecast for the next 7 days	date&weather_attribute
107	redwood city please.	date&location
108	when is my next meeting	event
109	give me directions to the nearest grocery store	distance&poi_type
110	sure, please send me its address on screen and pick a route to avoid all heavy traffic	traffic_info
111	check the weather for the 7 day forecast	date
112	los angeles, please. will it be hot?	location&weather_attribute
113	please give me the address and directions via the quickest route to a hospital around me. 	poi_type&traffic_info
114	what day is my lab appointment, and who all will be there?	event
115	i feel like some coffee where's the nearest place	distance&poi_type
116	are they any closer options?	distance
117	then let's go there, please pick a quick route for me	distance&poi&poi_type&traffic_info
118	when am i playing tennis	date
119	set reminder for doctor's appointment for the tenth	date&event
120	schedule a dentist appointment at 3 next month on the 12th	date&event&time
121	show me the nearest shopping mall	distance&poi_type
122	set gps for a route without any traffic.	traffic_info
123	is there an alternate mall with no traffic on the route?	traffic_info
124	tell me when my dentist appointment is	event
125	check forecast for new york	location
126	thank you. i would like to know if there will be frost in new york anytime over the next 7 days?	date&location&weather_attribute
127	can you direct me to a coffee or tea place nearby, preferably on a route with no traffic?	poi_type
128	give me directions to the nearest mall	distance&poi_type
129	thank you car, please set the gps with the fastest route to get there	distance&poi
130	what is the weather like today and tomorrow	date
131	will it rain in mountain view?	date&location&weather_attribute
132	where is the nearby hospital?	poi_type
133	give me the address to stanford childrens health.	poi
134	set a reminder for doctors appointment on august 14th at 4pm with my sister	date&event&party&time
135	what date is my football activity and who is attending?	event
136	check if there will be hail in cleveland this weekend. 	date&location&weather_attribute
137	what time is yoga class	event
138	schedule a 6 pm meeting with my boss to go over the quarterly report on tuesday.	agenda&date&event&party&time
139	show me the closest location where i can get chinese food	distance&poi_type
140	where is there a hospital around me?	distance&poi_type
141	ok, please give me the address and direct me there via a quick route. 	distance&poi&poi_type&traffic_info
142	find me a nearby shopping mall shopping center	distance&poi_type
143	will it snow in fresno in the next week? 	date&location&weather_attribute
144	remind me to go swimming on the 12th of this month	date&event
145	is it going to snow in the next 7 days	date&weather_attribute
146	boston	date&location&weather_attribute
147	car i need to get to a rest stop, please pick something with a quick route within 2 miles from here	poi_type&traffic_info
148	what is the date and time of my next football activity.	event
149	where can i go shopping?	poi_type
150	find out some information for my swimming activity, parties joining me and date. 	event
151	the one on the 8th.	date
152	where is there chinese food?	poi_type
153	pick a route to avoid all heavy traffic and let's go there, thank you!	poi&traffic_info
154	what is the weather like for tomorrow night	date
155	brentwood	location
156	check to see if i have any meetings or conferences in the near future	event
157	find the nearest coffee shop	distance&poi
158	yes, please, send it on my screen and pick a route to avoid all heavy traffic	address&poi&traffic_info
159	yes please.	poi
160	directions to coffee and tea house	poi
161	pick the one near my current location and avoid all heavy traffic please	distance&traffic_info
162	ok, give me the address to philz	poi
163	set an optometrist appointment for 3pm on the 15th of this month with my aunt	date&event&party&time
164	where is the hospital?	poi_type
165	yes, thank you	address&poi&poi_type
166	get me the weather forecast for the next 7 days	date
167	new york	date&location&weather_attribute
168	get me the weather report for this week	date
169	will there be a blizzard in inglewood?	location&weather_attribute
170	is it dry in fresno right now?	date&location&weather_attribute
171	what time is my meeting at	agenda&event
172	what's the forecast going to be for today and tomorrow	date
173	today and tomorrow, will there be clear skies in compton?	date&location&weather_attribute
174	please give me the address and directions by the fastest route to a coffee or tea place. avoid heavy traffic please. 	distance&poi_type&traffic_info
175	yes show me the address.	poi
176	put my optometrist appointment in my calendar	event
177		event
178	give me directions to the local coffee shop	poi_type
179	would you give me route details please?	address&distance&poi&poi_type&traffic_info
180	what is the current temperature	date&weather_attribute
181	redwood city	date&location&weather_attribute
182	where is the closest shopping center located at?	distance&poi
183	please give me directions via a quick route. thank you. 	poi&traffic_info
184	will it be stormy in grand rapids during the week?	date&location&weather_attribute
185	please give me the address and directions via the quickest route to the nearest gas station. 	distance&poi_type&traffic_info
186	let's try to go to shell.	poi
187	ok car assitant, plot the quickest route to shell.	address&distance&poi&poi_type&traffic_info
188	remind me that next week at 5pm i have tennis with jon.	date&event&party&time
189	what's the weather today	date
190	the temperature in exeter.	location&weather_attribute
191	update me on the weekly weather forecast for this week	date
192	will it be dry in durham next week?	date&location&weather_attribute
193	schedule doctor's appointment for august 3 at 10	agenda&date&time
194	is it cloudy today	date&weather_attribute
195	menlo park.	location
196	will there be clear skies in redwood city next week?	date&location&weather_attribute
197	where can i eat pizza?	poi_type
198	give me the address and name of the restaurant that is closest and located via the quickest route, please. 	distance
199	what are some nearby hotels	poi
200	send me its address and pick a route to avoid all heavy traffic please	traffic_info
201	find a parking garage.	poi
202	make a reminder for me to pick up my prescription later today	event&time
203	show me what time i need to take my pills	event
204	find home address that is within the distance of 5 miles.	distance&poi&poi_type
205	remind me about my football activity on the 1st, at 1 pm with my brother	date&event&party&time
206	set an appointment for a meeting on my calendar	event
207	find out if it will drizzle today or tomorrow in downtown chicago	date&location&weather_attribute
208	when is the football?	event
209	who is going?	event
210	i need to find out the time and parties attending my optometrist appointment. 	event
211	i want to know about the one that alex is joining me at	event&party
212	where can i go shopping?	poi_type
213	car i need to go to a grocery store: which one is it the closest to me?	distance&poi_type
214	would you give me the address and enter directions to the location?	distance&poi&poi_type
215	what time is my yoga class	event
216	what's the weather going to be like this week	date
217	is it going to foggy is compton anytime this week?	date&location&weather_attribute
218	on what day will it be foggy?	weather_attribute
219	remind me about the date and time that he was going to be there and what the agenda is for his business meaning	event
220	i would like to know what time and day my tennis is. 	event
221	where is there a shopping center within 5 miles?	distance&poi_type
222	mmm, no, i wanted some route with no traffic... is it the only option?	traffic_info
223	what is the weather going to be today and tomorrow	date
224	compton, please!	location
225	get directions to home	poi
226	i need a route with no traffic please. 	traffic_info
227	get me directions to the closest starbucks	distance&poi
228	where can i fill up?	poi_type
229	can i get the fastest route please.	traffic_info
230	what is the date, time, and agenda of my next conference?	event
231	i need a route to my friends that avoids heavy traffic. 	poi_type&traffic_info
232	what's the temperature going to be like this week	date&weather_attribute
233	cleveland	date&location&weather_attribute
234	where can i get some tea.	poi_type
235	yes, please! send me the fastest route with no traffic	poi&traffic_info
236	what is the forecast for new york city	location
237	okay, will there be clear skies on thursday?	date&location&weather_attribute
238	where can i get pizza?	poi_type
239	will it be windy in corona on wednesday?	date&location&weather_attribute
240	give me this week's high temperature	date&weather_attribute
241	in mountain view, please. 	date&location&weather_attribute
242	what is the date and time of my optometrist appointment?	event
243	take me home	poi&poi_type
244	thank you, pick the route with no traffic please	traffic_info
245	find a tea shop	poi_type
246	what are the directions to the mall	poi_type
247	yes, please.	poi
248	find nearest coffee shop	distance&poi
249	is the starbucks within 5 miles of here? if so, please direct me to the starbucks via the quickest route. 	distance
250	what's the weather like in grand rapids	location
251	will it be windy in grand rapids during next week?	date&location&weather_attribute
252	where can i get coffee	poi_type
253	yes, please pick a quick route to go there and send it on my screen!	distance&poi
254	what's the weather going to be today and also what is the weather going to be this week	date
255	i need weather information for today, especially about the temperature, for downtown chicago.	date&location&weather_attribute
256	where can i go shopping?	poi_type
257	would you give me the address of the location and directions by the quickest route?	distance
258	what hospitals are nearby?	distance&poi
259	yes.	poi
260	set reminder for laboratory request on this month on the 12th	date&event
261	when, where, and what time is my meeting, and who will be there?	event
262	okay and where is the meeting?	event&room
263	will it be hot in grand rapids on friday?	date&location&weather_attribute
264	what is the shortest route to home?	distance&poi_type
265	remind me when i can get my lab results	event
266	tomorrow's forecast	date&weather_attribute
267	i need the forecast in alhambra for tomorrow please. 	date&location
268	find me the best parking spot	poi_type
269	what is traffic like on the route to those locations and can you send me directions to the one without any traffic?	poi_type&traffic_info
270	yes, please give me directions via the fastest possible route. 	distance&poi&poi_type&traffic_info
271	set a reminder to take medicine at 10am on the 11th with my brother	date&event&party&time
272	set a reminder for a lab appointment on the 13th at 4pm with jeff.	date&event&party&time
273	schedule a conference with management on monday august 8th at 10am.	date&event&party&time
274	what is the weather like in new york city	location
275	there will be clear skies today?	date&weather_attribute
276	in mountain view, will there be frost today or tomorrow?	date&location&weather_attribute
277	what's the weather like this week	date
278	i would like to find out if it will be dry this week in new york	date&location&weather_attribute
279	what's the weather forecast going to be for each day this upcoming week is it going to snow	date
280	new york, please.	date&location&weather_attribute
281	i need to know who is going with me to optometrist appointment  and what day. 	event
282	what is the temperature for the next 7 days weather forecast	date
283	brentwood please	date&location&weather_attribute
284	where is the nearest rest stop?	distance&poi_type
285	give me the address and directions to the hotel that is located on the quickest route. 	distance&poi_type&traffic_info
286	where is the closest hospital?	poi_type
287	let's go there through the fastest way and with least traffic too, please	traffic_info
288	can you find out who is joining me and what day my optometrist appointment is at?	event
289	over the next few days will it rain in fresno	date&location&weather_attribute
290	what's the weekly weather report for the city	date&location
291	cleveland	location
292	will it be humid in inglewood during the next few days?	date&location&weather_attribute
293	will there be dew in menlo park next week? 	date&location&weather_attribute
294	will it be warm in san mateo over the weekend?	date&location&weather_attribute
295	take me to the nearest shopping center	distance&poi
296	give me the quickest route.	traffic_info
297	give me directions to my friends house	poi_type
298	i want pizza.	poi_type
299	yes, i'd like the route nearest me with no heavy traffic	poi&traffic_info
300	where can i go shopping?	poi_type
301	is it within 3 miles of my location?	distance
302	please give me the quickest route. 	distance
303	on thursday will it be overcast in exeter?	date&location&weather_attribute
304	what is the date and time for my doctor appointment? 	event
305	thanks set the gps to the avoid the heavy traffic please.	poi&traffic_info
306	remind me of a doctors appointment on the 29th	date&event
307	which one is gonna be the lowest temperature today and tomorrow in fresno?	date&location&weather_attribute
308	car, will you schedule a doctor's appointment for me? set it for 11 am, tomorrow, with jon.	date&event&party&time
309	what's the current temperature outside	date&weather_attribute
310	i'm located in exeter.	date&location&weather_attribute
311	what's the weather forecast for tomorrow	date
312	boston.	date&location&weather_attribute
313	find a grocery market for me please.	poi_type
314	how is the traffic around the area?	traffic_info
315	take me to the nearest grocery store	distance&poi_type
316	please give directions to that store by the fastest route. thank you. 	distance&poi&poi_type&traffic_info
317	i need to make an appointment to get lab testing done on a certain date	event
318	find me a nearby tea or coffee shop	distance&poi
319	yes and avoid all heavy traffic please. 	poi&traffic_info
320	please set the gps to this location. 	address&distance&poi&poi_type&traffic_info
321	remind me about my doctor's visit	event
322	what time is my optometrist appointment and who all will be there?	event
323	please tell me the weather for today and tomorrow	date
324	i want to know if it will be snowing in fresno.	location&weather_attribute
325	what time is my doctor appointment and who is attending?	event
326	the one on thursday please.	date&event
327	find me all the nearest hotels	distance&poi
328	yes, please, send it on map along with the fastest route too	distance&poi
329	i'd like to set a reminder for my meeting at 2pm later this month please.	date&event&time
330	it's on the 11th with management to discuss the company picnic.	agenda&date&event&party
331	take me to the nearest starbucks please	distance&poi
332	yes, please, send the address on my screen and pick the quickest route for me!	distance&poi
333	can you give me directions to the nearest starbucks	distance&poi
334	yes, please, check if there is a route with no traffic and send me its address on the screen	poi&traffic_info
335	schedule conference. 	event
336	set it for today at 4pm with my boss	date&event&party&time
337	is there a chance of snow in this weeks weather forecast	date&weather_attribute
338	san francisco.	location
339	is there a grocery store close?	poi_type
340	what is the temperature outside	weather_attribute
341	what is the temperature in camarillo right now?	location&weather_attribute
342	what is the weather supposed to be like for the next week	date
343	san francisco, will there be a blizzard, anytime this week?	date&location&weather_attribute
344	what is the time of my swimming activity and who is attending?	event
345	what time is my doctor's appointment today	event
346	can you find me a coffee place near me?	distance&poi_type
347	give me directions to my friends house	poi_type
348	ok, please give me route details with no traffic. 	traffic_info
349	check the weather for the 7 day forecast	date
350	manhattan, please. 	location
351	what's the temperature going to be for the week	date&weather_attribute
352	san jose	location
353	i want the whole week.	date
354	remind me about my optometrist appointment with my father on the 29th, at 7 pm	date&event&party&time
355	what time is the meeting	event
356	please tell me the weather for today and tomorrow	date
357	set a reminder for today's optometrist appointment at 3 with my mom	event&party&time
358	i need to find a gas station fast, we are about out. 	poi_type
359	find my home address for me around here in this area.	distance&poi_type
360	navigate to the nearest fast food restaurant	distance&poi_type
361	is there a grocery store within 5 miles? 	distance&poi_type
362	show me the route to coffee shop	poi_type
363	is it the quickest to get to from my current location?	distance
364	set gps on route to avoid heavy traffic.	traffic_info
365	tell me the date and time of my next doctor's appointment	event&time
366	doctor's appointment at 10 am on monday august 8th	event&time
367	what's the temperature for today	date&weather_attribute
368	i want to know the temperature in boston.	date&location&weather_attribute
369	will it be hot in redwood city on monday?	date&location&weather_attribute
370	schedule a swimming activity with marie for friday at 1pm.	date&event&party&time
371	when is my yoga?	event
372	what is the date and time for the yoga activity?	event
373	schedule my dentist appointment on the 12th	date&event
374	10am, please.	time
375	remind me about the football game	event
376	directions to local hotel	distance&poi
377	what about a rest stop while avoiding heavy traffic.	poi&traffic_info
378	will there be drizzle in the forecast for oakland this week?	date&location&weather_attribute
379	schedule an appointment for yoga	event
380	what is the date of my next dinner and who will be attending it?	event
381	can you find me a gas station nearby?	distance&poi_type
382	which one is it the quickest way to get there?	distance
383	schedule a optometrist appointment for thursday at 5pm. my father is joining me.	date&event&party&time
384	find out if alhambra will be dry this week	date&location&weather_attribute
385	what's the temperature	weather_attribute
386	i need to know the temperature for seattle on monday car. 	date&location&weather_attribute
387	take me to a place where i can get something to eat	poi_type
388	thank you very much car, please send the address on the screen and let's go there.	poi
389	where is my meeting, which parties will be attending, and what is the meeting about?	event
390	is it going to be raining this weekend	date&weather_attribute
391	los angeles, thank you!	location
392	where can i get pizza?	poi_type
393	which is closer?	distance
